{
  "$schema": "https://json-schema.org/draft/2020-12/schema",
  "title": "CircuitDrift device manifest v1 (equation family, pins, parameter bounds, scales, domain, provenance)",
  "type": "object",
  "additionalProperties": false,
  "required": ["schemaVersion", "modelId", "revision", "equation", "pins", "parameters", "scales", "provenance"],
  "properties": {
    "schemaVersion": {"const": 1},
    "modelId": {"type": "string", "minLength": 1, "maxLength": 64},
    "revision": {"type": "integer", "minimum": 1, "maximum": 1000000},
    "equation": {"enum": ["resistor", "capacitor", "shockley-diode"]},
    "pins": {"type": "array", "minItems": 2, "maxItems": 2, "uniqueItems": true, "items": {"type": "string", "minLength": 1}},
    "parameters": {
      "type": "array", "minItems": 1, "maxItems": 3,
      "items": {
        "type": "object", "additionalProperties": false,
        "required": ["name", "unit", "min", "max", "default"],
        "properties": {
          "name": {"type": "string", "minLength": 1},
          "unit": {"type": "string", "minLength": 1},
          "min": {"type": "number"}, "max": {"type": "number"}, "default": {"type": "number"}
        }
      }
    },
    "scales": {
      "type": "object", "additionalProperties": false, "required": ["voltageV", "currentA"],
      "properties": {"voltageV": {"type": "number"}, "currentA": {"type": "number"}}
    },
    "domain": {
      "type": "object", "additionalProperties": false, "required": ["maxExpArg"],
      "properties": {"maxExpArg": {"type": "number", "minimum": 0, "maximum": 80}}
    },
    "provenance": {
      "type": "object", "additionalProperties": false, "required": ["kind", "note"],
      "properties": {
        "kind": {"enum": ["synthetic-fixture", "measured"]},
        "note": {"type": "string", "minLength": 1},
        "source": {"type": "string", "minLength": 1}
      }
    }
  }
}
